{
  "schemaVersion": 1,
  "scenarioId": "between-waypoints",
  "source": "synthetic",
  "bodyLengthM": 0.7,
  "bodyWidthM": 0.31,
  "marginM": 0.15,
  "path": [
    [0, 0],
    [3, 0],
    [6, 0]
  ],
  "obstacles": [
    {
      "id": "wall-north",
      "min": [-1, 1],
      "max": [7, 1.2]
    },
    {
      "id": "wall-south",
      "min": [-1, -1.2],
      "max": [7, -1]
    },
    {
      "id": "training-box",
      "min": [1.4, -0.1],
      "max": [1.6, 0.1]
    }
  ]
}
